item_id,text,category,sub-category
3455,"The defence claimed self-defence, not stand-your-ground.",moral,fairness
3456,"Not the same as being gay, just having alter boys more at hand. Hopefully the modern number is small enough that the sample is small too. There are no reports of Vatican abuse, where the Lavender Mafia has its turf.",social-group,LGB
3457,"Using the name of a historic figure from 1300 years ago noted for killing muslims and driving them out of Europe is pretty obvious, don't you think? One reason I use Alceste is irony, skyofblue. Are you concerned about it?",random,random
3458,You do remember what Paul Martin had to do in the 1990's remember? You realize he had to do that because of a massive mountain of debt built up over the years preceding him. Ridiculous to say that red ink doesn't matter.,random,random
3459,"The sanctity of horse is ingrained, because they are animals that perform a service to humans, and are also pets. Can't compare them to cows and cattle.",moral,purity
3460,"Oh, so if someone comes out as gay, it might mean that he has an aversion to sex acts between people of the same sex?  Please.",social-group,LGB
3461,What's the matter with your world?'  Sessions is a closet transgender.,social-group,transgender
3462,Transgender people to not vote Republican in 2020,social-group,transgender
3463,"Wow, that Goldy is seriously racist.  It appears that Levant is a self-hating  Jew out to torment his brothers and sisters.  The Rebel is promoting hatred and division and Canada and should be investigated by the RCMP.",social-group,jewish
3464,"Except that most of the Republican hierarchy have failed to serve their country in times of war....Bush, Cheney, Rove, Trump etc. And the American values you speak of are exclusive of white Christian right wing folk....a minority in this country today, and are the values of hatred and bigotry.",social-group,christian
3465,"No longer needing Jewish votes, Mr. Obama was free, finally, to punish the Jewish state in a way no previous President has done.  Can there by any doubtâ€¦any doubt whatsoeverâ€¦regarding the real purpose ofâ€¦the Iranian nuclear deal?!?",social-group,jewish
3466,The only way LGBT lives are 'hell' is due to the effect of the  blatant bigotry on the part of this 'Prince of the Sect.',social-group,LGB
3467,"Somebody should explain to President Trump that we defend our country with more than rifles and cannons. Our complex weapon systems now demand brains and training. On these requirements our transgender soldiers amply fit the bill. Indeed, more so.",social-group,transgender
3468,"I hold the governing association responsible, not this transgender boy. He asked to wrestle with the boys and was denied. There is little question about the advantage he had over his female opponents by taking testosterone but, had he wrestled with boys, it would not have been an issue.",social-group,transgender
3469,"So, let us assume that Milo has an excuse for his views on the gay love. I  wonder what's Bill Maher's or Samantha Bee's excuse for being crude and hateful?",social-group,LGB
3470,"Gays  are not imprisoned and flogged in Israel as in Gaza, Iran, Saudi Arabia etc.   Pride parades in Israel  None from Morocco across north africa to Pakistan",social-group,LGB
3471,Another 'commentator' from central Canada that doesn't know thing one about which he speaks.,random,random
3472,"More accurately the Church of Jesus Christ of the Latter Day Saints reiterated its teaching that engaging in same sex activity is prohibited, and restating the consequences of flouting that teaching. Nothing here to see folks, move along.",social-group,christian
3473,"who knows, God may very well exist... I just don't think he's visited for quite a while",moral,purity
3474,Now maybe he will have to answer to his extremist views on women and gays.,social-group,LGB
3475,You have demonstrated your ignorance of the Catechism.   Canon 915 certainly applied to Tim Kaine due to the fact abortion is intrinsically evil verses the issues of prudential judgement.  It's too bad there are uneducated Catholics like you and Bishop McElroy destroying this Church.,social-group,christian
3476,"Hypothetical... your daughter is a boxer, she's the champ... and the undefeated top contender is a Trans Female... you cool with it?",social-group,transgender
3477,Jesus blowing freaks are a curse on education.,social-group,christian
3478,Your stupidity rises so high I can't see it from down here. ,random,random
3479,"if it is a reasonable search warrant, the courts could compel the defendant to provide the relevant password or hold them in contempt of court until they comply",moral,fairness
3480,"UOIT is a rapidly growing university winning respect for its academic programs, particularly in the sciences. Try to keep up.",moral,authority
3481,"No such thing as transgender - just males, females, and people with abnormal brain scans. Brain scans are abnormal among those who claim that they are really their own body's biological opposites.",social-group,transgender
3482,"Black, exactly what do you suggest that the government should do? Be precise.",random,random
3483,"One comment...WHO CARES?  What are there, maybe two transgender students in the state??",social-group,transgender
3484,"Marginalizing people', that's a laugh. You're the one to marginalize gay people. You also label people all the time. So, since you don't like homophobe, 'gay hater' will have to do.",social-group,LGB
3485,"One wonders how many of these French are Jewish, escaping the rising wave of Judenhass that has swept France. Regardless, the result is to the betterment of Canada and PQ. Bienvenue, et SantÃ©!",social-group,jewish
3486,"If Trudeau's government pushes forward with this, and the items mentioned in the 'open government' article, I will have massive respect for him and the federal Liberals. That they are promising to do this is very, very encouraging.",moral,loyalty
3487,Are you suggesting that when we meet a Muslim woman we should arrange to conduct our conversation on a telephone to get over the issue of not being able to see her face?,social-group,muslim
3488,This shameless vote is probably the last episode of Obama's 'Arab Spring' - radicalization Muslims everywhere and replacing moderate Muslim regimes with militant extremists.,social-group,muslim
3489,The purity of the blood eh? Where oh where have I heard that before?,moral,purity
3490,"This is Liberal policy. Would Justin force all of his MPs to vote in favour? Would they have to be Pro-Euthanasia to even run for the Liberals? Would he accept any limitations at all, or would it be 'on demand' ?",random,random
3491,"It's not racial rights, it's legal rights in the treaties stemming from the Royal Proclamation of 1763. You might want to learn some of this nations history, JB0713, and accept your responsibility to observe the law.",moral,authority
3492,All 'western' countries need to get their freaking act together and send lovely Muslims back to the middle east.  Let them fight it out for eternity.  Their problems are not our problems.,social-group,muslim
3493,"Yeah, well ... Justin may be completely abusing his position, but Harper was literally the anti-Christ. Plus ... uhhh ... conservatives are bad and evil.   So leave Justin alone.   (Submitted simply to save some time for the usual apologists.)",social-group,christian
3494,"Only partially facetious I blame that purple dinosaur, Barney. Where no one loses",random,random
3495,"Bravo. Let tolerance, equity and freedom be our passwords, and let them trump fear and hatred.",moral,fairness
3496,In the U.K. the word used was 'sissy'. It described boys who were unusually timid. Nothing sexual was intended as no one knew about homosexuality.,social-group,LGB
3497,exactly first is was 'Who am I to judge?' about gays  then later he does not want gay priests  all platitudes like Justin Trudeau,social-group,LGB
3498,Transgenderism is a guaranteed way of getting some attention when a youngster gets none at home.,social-group,transgender
3499,Oh those poor criminals just trying to get free stuff,random,random
3500,"Yes let's have free votes for culture war issues such as SSM, abortion, gun rights, prostitution, church and state, corporate lobbying, pipelines, whatever. It's more democratic that way.",moral,fairness
3501,Most Americans Support Open Transgender Military Service,social-group,transgender
3502,There is no such thing as secular values. Maybe that's why?,moral,purity
3503,Please mind you bigotry. We arent doing the 'gay equality is bad because of my god derp derp' stuff here.,social-group,LGB
3504,"Talmud is a Jewish text.  Jews tend to be Democrats, not tRump supporters and stood with and marched with blacks during civil rights - so puh-lease get your name straight without insulting a whole group of people.  You were responding to 'tulimd'.",social-group,jewish
3505,"There's some truth here... but as long as some Christians are pushing anti-science notions like 'intelligent design', it will be tough for the rest of us to take them seriously.  Personally. I think diversity is highly over-rated.",social-group,christian
3506,stoner' - a word with such positive connotations!,random,random
3507,Stupid as saying all Christians are responsible for paving the middle east over the years when it has been mostly the US and Britain,social-group,christian
3508,IRT Boots - You my friend are factually wrong. There has never been a study that concluded any person with X&Y chromosomes did any better as a woman. In fact the leading pioneer in transgender research has stated emphatically; 'the change more often does long term harm.',social-group,transgender
3509,Spoken by an expert in 'brown lipstick'.,random,random
3510,Ya where is the gender equality there??,moral,fairness
3511,Well it didn't take danepol too long to drag out that old canard - anti zionist = anti semitism! In fact I think Manjra is an equal opportunity phobe. His Islamophobia is positively shocking! And in Feinsteins casecase it is anti zionist=anti Semite=self hating non practising Jew!,social-group,jewish
3512,"If the day comes when a LGBTQ  or Islamic university exists, and they forbid Christians from becoming students, unless they are silent about their faith, will the government be so interventionist? Will Christians even be allowed to attend?",social-group,christian
3513,"excellent, Quinn is a complete dolt.",random,random
3514,"Yes. If this was reported in a unbiased newspaper, it would read:  'Black Man with Ties to Alt-left arrested for Threats on Jews'.  but....wow...there is Just Too Much truthful, disturbing facts! -it Must be 'spun', it must be 'softened'. Disgusting!",social-group,jewish
3515,"I choose not to be gay, and I am a bad actor.",social-group,LGB
3516,"Beyond hypocritical article. Obama has befriended rogue, anti-human rights, anti-gay enemies of democracy like Iran. Get over your fake news-based obsession with Russia and Trump, liberals.",social-group,LGB
3517,"Conservative? I don't think conservatives make bomb threats to Jewish community buildings, I think Nazis do.",social-group,jewish
3518,"If there's a bad choice available, Trump will make it! His latest pick of David Friedman as ambassador to Israel will most certainly not bring peace to the middle east. Does he want more Muslim extremists? Because that is how you get more Muslim extremists.",social-group,muslim
3519,"So, people being 'believers' or transgender are legitimate concerns of yours? Mississippi would probably love to have you. P.S. I think the irritation in the back of your throat is probably just BS.",social-group,transgender
3520,Yeah all cops strive for the day they can shoot and kill somebody! You really have no idea.....,random,random
3521,"Delusions, hallucinations, fairy tales, religion. Not one ounce of evidence for any of it. Why is belief in Thor, Ramses and Zeus scoffed at?Religion is the last bastion of the ignorant.",moral,purity
3522,The headline makes it sound like it's the School Board promoting hate. Not cool. It should read 'Ontario School Board's support prompts anti-Muslim backlash.' The school board is not fueling this hate. The hate is coming from bigotry and racism.,social-group,muslim
3523,Islam permits true believers to dissemble in order to protect their beliefs and faith.,moral,purity
3524,"If you are openly gay, does that mean you are sexually active?  Because that would merit suspension all by itself.",social-group,LGB
3525,The fundies' war on gay marriage is ironic. They ought to welcome any support for a declining institution.,social-group,LGB
3526,"Details, details RealistLon ... you must trust the Liberal Force, or be swallowed whole by the Dark Side. How else can a fledgling personality cult get a start?",moral,authority
3527,"And Palestinian's are the UN's chosen people in their objective of eliminating Israel and eradicating Jews from the region. Personally, I prefer God.",social-group,jewish
3528,I agree the law should. But adding gays to if won't do that. Elimination of the law will.,social-group,LGB
3529,"I might suggest looking up 'The Lords Resistance Army'  They are very much Christian terrorists.  I might also suggest looking at the terrorism perpetrated by the IRA, again, Christians.",social-group,christian
3530,Trump cited no credible source indicating that transgendered troops are a detriment to the effectiveness of the U.S. military.  It appears he is making statements like this to solidify his homophobic core supporters.,social-group,transgender
3531,Im offended at your homophobic thoughts- you know its ok for one guy to like another guy.... even though that guy might be transgender-,social-group,transgender
3532,"As your post demonstrates, Civil Comments has disabled the civility filter for the folks who were complaining about too many Catholic posts. Along with adding blocking, that puts things more or less back where they were with Disqus.",social-group,christian
3533,Trudeau and Harper are relatively close in age. You realize that right? Harper just looks older... and fatter.,random,random
3534,"As long as he doesn't watch it, he can say: Still haven't actually seen video of the 'Jews will not replace us' thing. Sounds like an urban legend. Willful ignorance.",social-group,jewish
3535,"and yet here you are accusing the Jewish Zionists of mere 'excesses' against non-Jews in Israel and saying absolutely nothing about Israel's barbaric, genocidal treatment of ten million Palestinians since at least 1935.",social-group,jewish
3536,"I wonder what would happen if the Pentagon brass decided that tweets are not official orders, and simply waited for Trump's milliseconds-long attention span to be diverted elsewhere? 'General Dunford, is the transgender issue taken care of?' 'Yes, sir!' 'Fine. Carry on.'",social-group,transgender
3537,Rep. Hensarling will say it was gay people's fault.,social-group,LGB
3538,Maybe Mary was bodily assumed into heaven because Jesus wanted to keep the Church from pawing at her bones?,social-group,christian
3539,What's your point - that this is normal and our climate is not changing? Wake up! The trend is clear based upon evidence. We are in a time of serious climate disruption with devastating consequences if we refuse to act to stop fossil emissions.,random,random
3540,And just how would that ever be enforced with any confidence of integrity whatsoever! Your post is the perfect example of why our rights and freedoms are disappearing. You rationalize it for them (and for us). No thank you mog_man!,moral,fairness
3541,I suppose you're right. If it ends up being a Muslim who carried out the attack we can just call it muslim on muslim shooting. or Muslim Terrorist attack?,social-group,muslim
3542,arab culture do not compliment western culture there will be many many problems to come,random,random
3543,His supporters with racist aliases. Mexicans are rapists. Ban Muslims.,social-group,muslim
3544,And fear and loathing of gays.,social-group,LGB
3545,"Someday Lorna is going to tell us how important Christians among us - yes, even our most eminent churchgoing government leaders - practice the ethics and moral purpose that they take from the good book. But I will not hold my breath in the interval.",moral,purity
3546,that commitment and ethic will bode well for the future........good luck,moral,purity
3547,The usual sane analysis from Mr. Heinbecker.,random,random
3548,"Can we say Islam is bad? Islam is threat to Canada? It's illegal to say such thing?   Can we discuss this topic:    if Muslim becomes majority in Canada, or even 20%, What kind of Canada will become?",social-group,muslim
3549,The suicide rate for homosexuals is 4x greater (CDC stat).  Use of psychoactive drugs high.  Gay in this sense is a huge misnomer.,social-group,LGB
3550,"Canadian politicians promised to be nice to one another after the Jan 2011 shooting of Senator Gabrielle Giffords in Arizona. Like most promises from politicians, they are soon forgotten.",moral,care
3551,"...cannot be burdened with the tremendous medical costs...Again, our President is correct.' The military spends more on Viagra than transgender medical costs. The military has spent less on transgender medical costs than the country has spent on Donald's golfing hobby the last seven months. Your President is wrong again.",social-group,transgender
3552,Killing is always a good thing...just ask Jesus in prayer.,social-group,christian
3553,you can knowingly infect someone with aids and it's ok. you can go to jail if you don't use the proper pronoun when speaking to the transgenders. are the flames hot enough yet.,social-group,transgender
3554,This just in: Mass shooters are mentally ill. Wow. Really? Who'd a' thunk it?,random,random
3555,"Good start, but don't forget about indigenous, visible minority and trans-gender. I'm not making fun.  These and other categories follow closely on attempts to correct imbalances politically.",social-group,transgender
3556,"Sure, because such medieval nonsense has absolutely no bearing on having faith in Christ and following his teachings. Why dabble in this extra-biblical nonsense which, as we have seen, so easily lends itself to abuse, corruption and distraction?",social-group,christian
3557,Protestants? Jews?,social-group,jewish
3558,This must be the work of Satan.  They probably rejected Christianity as being a 'white man's religion'.,social-group,christian
3559,Black Pride = being black and proud Gay Pride = being gay and proud White Pride = NAZI! - Hypocrisy is a greater crime than racism.,social-group,LGB
3560,"Since my prostate surgery so do I, but I do it in the proper gender assigned bathroom unlike the mentally deficient phony group calling themselves 'trans people'. You are as you came into the World, and even assignment surgery does not change fact to fiction.",social-group,transgender
3561,"A one legged, multilingual ,trans, first nations, marxist should be appointed.",social-group,transgender
3562,I am sorry to hear that you were homophobic and hope you have overcome it. As a Catholic I am not and have never been homophobic so I have never had the need for such an examination.,social-group,christian
3563,"I am white. Not a single one of my rights is threatened by my Muslim or Chinese neighbours. On the other hand, I do feel threatened by ignorant people who see immigrants and people of colour as the enemy.",social-group,muslim
3564,"her grandfather was a Nazi , or a Nazi collaborator and  clearly  a propagandist.  Basic fact .   Her  grandfather helped kill Jews in the millions  Has she ever admitted this  fact while attacking Russia today and defending Nazi collaborators in her own family ???",social-group,jewish
3565,"It's a simple fact that there is no mention of a sexual encounter in the report. It's a quick read, you should check it out. By your logic, is everyone who does not support her a homophobe? I am neither a lesbian nor a homophobe, nice attempted troll though.",social-group,LGB
3566,"Nancy Pelosi is right. She is the top Democrat fundraiser so black, liberal and transgender Democrats should best shut up and stop complaining. It's her party and she is the boss.",social-group,transgender
3567,I've already popped the pop corn. How will Francis deal with this magna cappa pirate. (There is gay humor lurking in this analogy somewhere!),social-group,LGB
3568,"Here are Kristin Beck's (a transgender ex Navy SEAL) own words to Trump:  ''Let's meet face to face and you tell me I'm not worthy,' Kristin Beck, a 20-year veteran of the Navy SEALs, told Business Insider on Wednesday. 'Transgender doesn't matter. Do your service.'  http://www.businessinsider.com/kristin-beck-trump-transgender-ban-2017-7",social-group,transgender
3569,These warlock Dems did not deny Catholics when president Kennedy won they just killed him.  May God forgive them.,social-group,christian
3570,Islamophobia is completely justified because Islam is the religion of the Quran of which the unbeliever or infidel is to be killed in the most brutal means and  sharia law imposed.,social-group,muslim
3571,Except there is no God.,moral,purity
3572,"Arguing in neo-Marxist platitudes? Yes, that person was born a he, so it seems nature is 'anti-trans microaggressing,' according to your neo-Marxist Critical Gender Theory beliefs.",social-group,transgender
3573,"For the Gay community and the Black community, both whom have been successfully pressing for broad inclusion to exclude the police whom the vast majority of people strongly support, is more than ironic.  It's just plain wrong.  Count me out his year.",social-group,LGB
3574,"You must be a Republican.  Swirling black hole where your heart should be ... Hatriotism!!  Praying hard to the money gods while calling yourself a Christian, but we all know by now today's Christian is a 'christian'.  Super fakey!",social-group,christian
3575,The gays need colonoscopy.,social-group,LGB
3576,And don't forget that their version of Islam throws gays off buildings.,social-group,LGB
3577,"Yeah, it's clearly too hard. Let's just give up and let the carnage continue.",random,random
3578,That was simply an excuse... The average German soldier will claim they never fought to exterminate the Jews....,social-group,jewish
3579,The Pharisees are the predecessors of rabbinical Judaism. Isn't it way past time Christians dropped the whole 'you killed our Lord!' talk?,social-group,christian
3580,Americans know something Canadians don't. No one really wants to look at a Muslim woman.,social-group,muslim
3581,Amen brother,moral,purity
3582,Considering transgender bathrooms 'fringe' is what will get you tarred and feathered in a modern university.  You are an 'old-fashioned Marxist' stuck in the 60s.,social-group,transgender
3583,So what is the percentage of the 3 out of 1000 people that are transgendered that want to enter the military? Maybe the transgendered should pick other battles.,social-group,transgender
3584,Lesbian reject men so why should men protect them?,social-group,LGB
3585,"oh please, you think the session moderated by Independent Jewish Voices, a notoriously Israel and jew-hating organization, is going to be a fair and balanced discussion on human rights?  What utter nonsense.",social-group,jewish
3586,"Knowledge is power. Less knowledge for the public means more power for the government and the elites. The powerful become more powerful, the powerless become more powerless. That's the way the powerful want it.",moral,authority
3587,"Oh great, thanks to Trudeau Canadians are now effectively forced to buy Middle Eastern oil and to fund islamist terrorism whether they like it or not. Meanwhile, Paul Martin's shipping company can continue to lavishly profit from the tanker trade. Coincidence?",social-group,muslim
3588,"Fake Senator, Fake Tories, Fake Christians...",social-group,christian
3589,Could we have a list of acts of terrorism committed by Syrians in North America? Or anywhere?,random,random
3590,This clarifies the situation - or does it? Is the Queen gay?,social-group,LGB
3591,"The law is cowardly.  These same Quebec Liberals went to the funerals of 6 dead Quebec City mosque members back on January, 2017.  Ten months later, they make a law that targets Muslims.  I guess for Quebec Liberals, the grieving period was over.",social-group,muslim
3592,This is a huge mistake and a setback for acceptance of the gay community. If I lived in Toronto I would boycott the parade after this decision.,social-group,LGB
3593,Maybe they should have a transgender division - the current system doesn't seem fair.,social-group,transgender
3594,That explains all those Jews getting put to death in Israel for cursing their parents.../s,social-group,jewish
3595,"I have to call bs here. I'm a churchgoing Christian, and there is nothing in our teachings that says it's okay to prey on young girls. These people are lunatics. It's not okay to generalize. There are lunatics in every faith (or non-faith).",social-group,christian
3596,"London, as well as most of Europe, is deteriorating rapidly.  London now has a Muslim mayor which shows how they have infiltrated all levels of government.",social-group,muslim
3597,"You conveniently don't mention your cohorts who call for extermination of Jews and Blacks. With guys like IQ006, IQ22, and the rest in your corner, well, I wouldn't call you  loathsome or deplorable like them but I think ' imbecile' has some merit for your selectivity.",social-group,jewish
3598,Is  LBB  Barry  back  from  his  gay  sex romp  in   the  south  seas  yet?   When  he  left Moochelle at  home?,social-group,LGB
3599,"At least in that they continue the traditions of the Church, as Saint Pope John Paul II the Great was a firm believer in protecting pedophile clergy.",social-group,christian
3600,Muslim prayers are certainly something to be afraid of.,social-group,muslim
