item_id,text,category,sub-category
2294,"Pandora, just because you suffer from the delusion that women are not second-class citizens in the Catholic Church does not mean that others share your folly. These women were protesting an injustice. What is awful is your objecting to it.",social-group,christian
2295,Paranoid'? People pointing out a clear advantage FOR this individual in a field of competition are 'paranoid'? Fairness is taught in ALL fields competition. At all levels. From youth to professional. There is clearly something wrong here. Otherwise create a transgender division.,social-group,transgender
2296,"Drug addiction is a malady, so compassion is warranted.",moral,care
2297,"It's no myth. Not only do they get paid quite well in Alberta but they are paid as 'independent contractors'-------------------------Ah. Not all tradespeople live in Alberta. That probably surprises you, though.",random,random
2298,@MMackinnon Yes in the Chretien and Martin years there was a more peaceful world... Terrorists would not have blown up WTC in 2001 just a few miles south of the Canadian border.,moral,care
2299,"There are other ways to protect your home - martial arts, for example",moral,care
2300,They still throw gays off buildings and stone women.,social-group,LGB
2301,Members of one religion bombing members of another...just as Christians killed Cathars or Catholics killed Protestants (and vice versa) years ago. Maybe absolute certitude that you are hearing the true teachings of God is not always a good thing.,social-group,christian
2302,"Excuse me, people of Jewish descent are not asian. That is absurd.",social-group,jewish
2303,"That's not exactly the reason why you were suspended though, is it?    From what I read, it was because of your open and supportive stance for gay marriage in defiance of Church teaching, your Twitter comments and activism....not because you are gay.",social-group,LGB
2304,An amazing shot when you consider that the person who took it is a transgendered aboriginal.,social-group,transgender
2305,"I presume a combat rosary saw service in Iraq or Afghanistan.  While Mary loves all the troops, I am not sure that Mary the Palestinian Jew would approve of any foreign occupation by an imperialist power, speaking of that other kind of Americanism.",social-group,jewish
2306,"I don't think you can compare Trump wanting to keep criminals and illegal migrants out of the country to Hitler's disgust for Jews. Btw, how many Syrians has Israel adopted?",social-group,jewish
2307,"Earlier this week, 56 retired generals and admirals came out against Trump's ban on transgender troops, arguing it would be disruptive and degrade military readiness.",social-group,transgender
2308,"Why would the daughter of a draft dodger, who has just slapped the face of every serving American transgendered person be chosen for a ceremonial task of honour?  Time to for the government to remove her from the guest list.",social-group,transgender
2309,I didn't know journalism degrees come in crackerjack boxes. This girl no doubt got hired for her looks.,random,random
2310,Damn that Trump!  Now he has turned blacks against Jews.,social-group,jewish
2311,"Those pharisees said Jesus was a cafeteria Jew.   I don't know why, cause  Jewish food is delicious (except that gefilte fish, oy gevalt, it's shreklekh).",social-group,jewish
2312,"Nobody should be force to speak french it is ridiculous. | Canada needs to be split into four separate countries: French, Native, Catholic and Agnostic.",social-group,christian
2313,Cannabis has been used to treat addiction to hard drugs -- might work for Nicholson and Toews as well ... we could only hope.,random,random
2314,GDP grew during the financial melt down of 2008 and onwards? Now who's drinking the coolaid.,random,random
2315,"Sure you want people to be damned. If you did not want it, you would reject Canatate Domino and accept Dignitatis Humanae.  Your God is a bigot. He sends Jews to hell for being Jews. How does this differ from the Nazis sending Jews to Buchenwald for being Jews?",social-group,jewish
2316,"Catholic social doctrine is not owned by the 'left'. The Church was established by Christ as a hierarchical institution, not an egalitarian one; and was empowered to determine right from wrong based on revealed truths, not epistemic relativism.",social-group,christian
2317,hes way too smart. (the bar is low),random,random
2318,"No right minded person would want to enter those places, unless they were Muslims, what they call a place of worship is frankly a place to breed fear and judge people.",social-group,muslim
2319,"Shame, indeed!  But Christians don't think laws apply to them.  You know, 'religious freedom' and all.  'Render unto Caesar. . . '  Oh, never mind.",social-group,christian
2320,"Target still hasnt recovered since their stock tanked after implementing their store's gun free status, and Obama's transgender bathroom nonsense.  How could this 'news story' ignore that 10,000 pound elephant in the room?",social-group,transgender
2321,"Utilitas, you keep insisting that all Trump voters are not racists.  Yet you are saying all Muslims are terrorists.  Do you see a problem here?",social-group,muslim
2322,Anti Muslim name????? How exactly is defending France against invading moors in 729AD 'Anti Muslim'?,social-group,muslim
2323,When you start worrying about the 'human rights' of terrorists.................,random,random
2323,When you start worrying about the 'human rights' of terrorists.................,moral,fairness
2324,Yes that's right. Only you and Fanfret know the path to truth. Which of course is why we dont need a referendum. Because we have Liberal Party hacks and spinners like you guys to design a new system for us.,moral,fairness
2325,"The truth hurts, don't it, Barry?",random,random
2326,"If Trump's goal was to ban all Muslims, why does his executive order apply to only 1% of the Muslims in the world?",social-group,muslim
2327,Don't think all black gay guys agree with BLM.  But because of the colour of their skin they are ignored by  media politicians and even BLM.,social-group,LGB
2328,"More treacherous than Nixon?  Yet, the outgoing tyrant called white, christian, conservative a domestic terror threat.  Hey, Berstein, GPS!",social-group,christian
2329,"No, because Muslims don't let their women out of the home.  They also don't have gender fluidity.  Therefore, the only option is a manhunt.",social-group,muslim
2330,Canada was established on Biblical principles.,moral,purity
2331,What Quebec wants is Chinese immigrants who drop off half a $-million on their way to Vancouver.,random,random
2332,"True, we can just ask gays their experience and then trust them when they provide it. Sexual morality is for them, not for God. What bothers you more is not their morality but the public authority of the Church hierarchy, which God does not care about.",social-group,LGB
2333,"He was getting fresh with the transgender woman, and she said 'Cut it out!'",social-group,transgender
2334,"The fact that this person is transgendered shouldn't matter. The real question should be, can she do the job?",social-group,transgender
2335,"I think Mr. Khan covered it pretty well.  In later interviews, Mrs.Khan addressed Mr. Trump's claim that she 'was a Muslim woman and, therefore, wasn't allowed to speak.'  Mr. Trump reminds me of the old 'Limbo Rock' lyrics..........'how low can you go?'",social-group,muslim
2336,If probably more than half the priests are gay why are they against gay people and their marriage rights? Are they angry they can't gay marry?,social-group,LGB
2337,Liberals are still crying over the fact that Mateen wasn't a white Christian.,social-group,christian
2338,"As a Canadian trans woman living from time to time in the US I am feeling very vulnerable, and very angry. Thank you for stating this so well.",social-group,transgender
2339,"OH NO! The snowflakes will have to pay for their education of black studies, women's studies and transgender studies! Oh the humanity!  The good news is that a degree in transgender studies will ABSOLUTELY help you get into a profession paying $150K year.",social-group,transgender
2340,"Seth.. Good comment. I am very happy to see that there are some honest, capable people out there trying to help Ontario save itself from the largely left wing disaster called renewable energy.",moral,care
2341,"Don't worry. Trump has already played the transgender card to please his base. He's got GLB remaining, as well. If the heat gets too high for Trump, if he's not feeling the love, he'll make sure Hillary Clinton does the perp walk. The ratings on Fox will be yuuuge.",social-group,transgender
2342,"Gay rights are more than marriage. But yes, if you are against gay marriage, you're a bigot. And you are a bigot. Roskell.",moral,fairness
2343,Why not post the names of the adults? Must've been another Christian hate group.,social-group,christian
2344,"Ad absurdum much? 6 million Jews, not arguable. 6 billion sperm? very arguable.",social-group,jewish
2345,Great writing. As an ex parrot... er.. christian - it's good to hear of good sense in amongst the adoring patness.,social-group,christian
2346,"I think the G&M gets these 'articles' for free - and the authors thereby obtain a soap box for their pet diatribes, mostly uninformed !",random,random
2347,"Such clubs fan the spirit of victimhood and nurse self-focus.  Never a good thing to do.  I can't see St Maximilian Kolbe (feast day today) starting a club in Auschwitz for 'condemning the bigots' who gassed the Jews and himself.  Instead, he used all of his time very well...serving others.   Argument emptied.",social-group,jewish
2348,so basically you're fantisizing about getting a legal reason to kill someone. You are a horrible person,random,random
2349,"Hey, don't sweat it.  We kill thousands of Muslims every month over in the middle east.  We're well ahead in the body count.",social-group,muslim
2350,He didn't take action with the Jews in Rome.  He actually let them be rounded up.,social-group,jewish
2351,Most of us have grown up and no longer refer to gays as icky.  Time to move into the 21st Century.,social-group,LGB
2352,"Was this story written by a jew? The import tax is now 300%. Tell you what Globe, cancel my fucking subscription. Period.",social-group,jewish
2353,"GOD has changed?  Say what??  I doubt you studied Catholic theology on a graduate level; but if you did, get a refund.",social-group,christian
2354,"Funny, no parliamentary motion to quell the Quebec imam who preaches for the extermination of the 'accursed Jews.'",social-group,jewish
2355,"The press is trying to jump on every major and minor misstep Trump makes but many admire his politics. He has a very good chance of becoming the next president even though many, especially the establishment, do not like the idea.",moral,authority
2356,"The fact that religion is based completely on faith alone does not necessarily make it 'unequivocally' crazy. Your well-written comment would have been much stronger (for me, at least) if you had chosen a better example.",moral,purity
2357,Trump is their savior.  They said so.  If a protester is run over  by a car will Trump even speak about it?  The wery good people chanting â€œJews will not replace usâ€.  What a disgusting pos,social-group,jewish
2358,"And here I thought we were doing so well, with not a cathouse or casino in town. I forgot about the homosexuals. No wonder we're being smitten.   (That was sarcasm, if anyone misunderstood.)",social-group,LGB
2359,Thank you for your service and may God keep all our military service members SAFE.,moral,purity
2360,Star_Chaser - 'The most bigoted people I have seen here are the Harper haters.'Just like Israelis and Jews who oppose the policies of the Israeli government are 'anti-Semites'? Your attempts to criminalize political opinion are pathetic.,random,random
2361,Canadians won't be in a position to say 'we have made amends' for at least a generation AFTER the government has demonstrated it is treating aboriginal people with respect. That has only just started after a decade of going backwards.,moral,authority
2362,Gee the geniuses at the Glob of Muck are just finding out that Trudeau is just your garden variety lying Liberal ..brilliant !,random,random
2363,"Transgenderism and other politically correct stupidity will be the downfall of Western civilization.  Sorry if this offends the minority, but most normal people are tired of this nonsense.",social-group,transgender
2364,"Ruling government' !! That says it all. Like yourself, Harpo appears to think he was elected to reign over us.",moral,authority
2365,Which military commander is saying that transsexuals are good for the military?  Name one.,social-group,transgender
2366,"Sure it was, HM, but the shooter was born in the USA. A Muslim ban would have changed nothing.",social-group,muslim
2367,A 'post-American era'--what is Hillary a secret Muslim like Obama?,social-group,muslim
2368,"Shias, Sunnis, and all other Muslims as well as Christians, Buddhists, Hindus etc. can find a safe haven in Israel. Just stroll around the streets of Jerusalem and see all the various worshipers freely observing their religious practices.",moral,purity
2369,"Oh boo hoo! Another sob story from the liberal Kool-Aid factory attempting to make us feel sorry for the most hateful, misogynistic, homophobic, racist group in Canada that produces the vast majority of terrorists. Not that the Globe is taking sides or anything...",social-group,LGB
2370,A transgender identy child has suicidal tenancies???  May want to inform the parents then.,social-group,transgender
2371,"Let me get their logic straight: Jesus was a pedophile, so it's ok for Roy Moore to be a pedophile?  Wow.  Just wow.",social-group,christian
2372,"Pizi It makes no sense to occupy a strip of land partially occupied by and surrounded by your enemies. Nothing to do with ownership of the land.  If Jews bought Palestine, their reception would be the same. It makes no sense to..........................",social-group,jewish
2373,CDNWorker writes: 'Honesty and integrity do matter.'=============The recent Ontario election demonstrated that these two things are not particularly high on the list of voter concerns.,moral,fairness
2374,I could also ask why left-wing Catholics supported an amoral philanderer conman like Bill Clinton.,social-group,christian
2375,Don't you find it is becoming rather monotonous and predictable? It may seem to be parodying traditionalists but in reality it is a mockery of the Catholic Faith.,social-group,christian
2376,"forwhatisworth, When these people started 50 years ago to want to kill all Jews and continue to think like that instead of negotiating a settlement they deserve what they have. Terrorists are terrorists and desrve to live in ruins.",social-group,jewish
2377,Yippee! And the point of this is what exactly? To trivialize homosexuality even further? I'm thinking opening the first all-gay lawn care service. That will make me 'courageous'!,social-group,LGB
2378,"So the children graduating from Catholic Schools have actual knowledge that the Catholics Imaginary Supernatural buddy is a fraud and public School Grads do not?  Private Schools do better because they can refuse or expel problem students, or ones that require more resources.",social-group,christian
2379,"Russians didnt like Hilary Clinton, Israelis hated Obama (Bibis government) Both Russians and Israelis meddled in the election. But everyone is very quiet about the Israelis. Putin and Bibi hooked up last week never mentioned in mainstream media. I guess being Jewish has its privileges !",social-group,jewish
2380,"The ACLU says an estimated 8,800 or more transgender people currently serve in the military'. Are they referring to actual transgender, or just grouping as queer. 8800 sounds a bit high.",social-group,transgender
2381,"Nothing but fears and jeers, Gay.  Keep whining.",social-group,LGB
2382,"Trump's banning of transgendered people was certainly arbitrary but I don't think it will have a drastic effect on LGBTQ rights, especially not in Canada.  Their rights are too entrenched now. They have become unshakeable like the rights of women.",social-group,transgender
2383,"That will be happening here in Canada very soon.... as a matter of fact, it may be going on right now.  In Richmond Hill there is a Muslim-only housing community where it's forbidden to walk your dog on a public street.",social-group,muslim
2384,Or the incompetents that are running the liberal party now.,random,random
2385,How about the rights of working Canadians who pay $14 BILLION a year in funding they get with no accountability?,moral,fairness
2386,What about your RoboCall Scam and the investigation and muzzling election Canada so they can't ask questions of the scammers? That doesn't bother you eh?,random,random
2387,"the price we pay, low as it is, mostly goes to the middle man and not to the sweat shop workeryet progressives, leftists, socialists, Marxists in the West keep on buyingforgetting their public pose as advocates of Social Justice",moral,fairness
2388,"No, he's not proTrump, but only because Trump is anti-Muslim. And unless you're a Muslim, Minshall has no use for you.",social-group,muslim
2389,"Redford yet again shows She is more aligned with Her bretheren at the UN than Alberta... Lawyers do that, it's called Weasel words... used in an Election, then do something else altogether! One hit blunder this one...",random,random
2390,"Freedom of the press belongs to those who own one'It's the internet age. DIY, start your own website and let the comments fly. It's never been easier.",moral,fairness
2391,... it really is only about 20% support this monster.  What is SAD is that 80% of THAT 20% consider themselves Christian.  Disturbing!!,social-group,christian
2392,sorta like the anti infidel hate practiced by the Muslims.,social-group,muslim
2393,"Joey, it's not the gay agenda, it's the black agenda. Membership has been declining since 1974, when the Boy Scouts were forced to integrate blacks into their troops. Equal rights are ruining the morally straight....",social-group,LGB
2394,"Oh they know, they just love having this as a stick to poke LGBT folks with.",social-group,LGB
2395,When it calls me a 'rag-head' I disagree.  Guess since it's a tranny should be OK for me to punch it out without being accused of 'hitting a woman'...,social-group,transgender
2396,"Neither is Bernie, but Bernie is also trusted by the people.",moral,authority
2397,Forget the prejudice junk. And forget the neighbors junk. Practicality and economics.  And if you don't think an openly transgender in a barracks with 100 men isn't detrimental to the military mission then I give up.,social-group,transgender
2398, I don't see the death of Western Christianity as a bad thing ' .  It doesn't get much more pathetic than that.,social-group,christian
2399,Baloney! Separate school boards in Alberta feature prayers and Catholic religious courses. Holidays at Christmas and Easter are Christian celebrations. You'd do better to hide your prejudices and keep your shallow thoughts to yourself.,social-group,christian
2400,"if you are browsing these comments, you are definitely a divorced, unemployed loser. get a life",random,random
2401,We need a cohesive plan to get paid for our resources in cash in envelopes.,moral,loyalty
2402,"These people here regularly hold up Westboro Baptist, the Catholic Crusades, and the Catholic Pedophilia as a model for Christianity, which is ludicrous, they only demonstrate their own ignorance and bias.",social-group,christian
2403,I don't know about 'constitutionalizing'. Parties are most certainly already legally recognized and given great power by both law and Parliamentary Rules.,moral,authority
2404,Your equalization money.,random,random
2405,Can you provide proof that the number of reported hate crimes against jews has been falling?,social-group,jewish
2406,"Not like the right wing was obsessed for 8 years with the secret-Muslim, non-American, baby-killing Obama, no?",social-group,muslim
2407,Check the FBI and CIA sites for information on the religious affiliations of terrorist groups. There are definitely Christian-affiliated (self-identified as Christians) terrorists.,social-group,christian
2408,Pedophilia? Hmmm? Catholic much?,social-group,christian
2409,Catholicism certainly. They were expert terrorists.,social-group,christian
2410,"Yup, conservative politicians like Kenney who still can't force himself to say that lgbtq rights are legitimate, that gay support groups in schools are a good idea..",social-group,LGB
2411,Get used to it. Liberals believe that they have a God given right to tell all of us how to live their lives.,moral,purity
2412,Thank you for such a fine article! I particularly listen up to the parallel between raw anger and raw empathy.,moral,care
2413,Bravo !  Hispanic Catholics are like Italians or Irish of a century ago....the next big winners in America's economic lottery.  Why Hispanic Catholics would ever want to copy-cat the Black Protestant Democratic Party disaster never made sense to me.,social-group,christian
2414,"I don't subscribe to a religion, but to a relationship with Jesus. I think for myself and strive everyday to act decently.",moral,purity
2415,"Muslims are the worst Islamophobics of all . Ancient hatreds and wars of extermination between Kurds, Shiite, Sunni, Wahhabi, Druze and other Islamic sects are worse than anything expressed in the west, even by Trump.",social-group,muslim
2416,"What trash, Tridentinus!  There are many who leave the Church for other very important reasons, the sex abuse cesspool for example.  Your rigidity reflects something entirely different from the Church of the Gospels.",social-group,christian
2417,"You have to admire Margaret for her willingness to take on sacred cows, whether you agree with her or not.",moral,purity
2418,Your post is very short-sighted and uneducated......trans-gender restrooms has got to be just as important to the council.,social-group,transgender
2419,"Right on! Each time Harper opens his mouth, I?m reminded of, ?I did not have sex with that woman,? and ?It?s not a crime, when the president does it.?",random,random
2420,"Get ready for more of this nonsense.  Once transgendered rights are elevated to the point of disallowing any thoughtful criticism, the lunatics will use their new found powers in ways that make 'self serving' an understatement to say the least.",social-group,transgender
2421,"don't shoot the messenger Skeptical - if you all you have is insults and abuse, you have as much as admitted you don't have a position you can defend and the other right.",random,random
2422,"No, we do not. You've had your day, get lost, buh bye.",random,random
2423,He'd feel as safe as he did in the broom closet.,moral,care
2424,"Perhaps if you avoided hard liquor this early in the day, that may make a difference in how you approach the subject matter?",random,random
2425,Fair points on Adams and Blair.,moral,fairness
2426,"They're the intolerant and authoritarian type of people that are like this towards minorities. The authoritarian mentality has reared its ugly head in recent years using Muslims as the current scapegoat. In time, they'll drift away to other groups...",social-group,muslim
2427,So who's the bigger threat to Americans??? Islamic Terrorist or American Terrorist killing thousands of Americans in places like Chicago??? #MAGA,social-group,muslim
2428,"The hierarchy of the Catholic Church in the USA are a rigidly politicized group. Their alliance with far right anti-gay forces, and their intellectually dishonest embrace of a phony notion of 'religious freedom,' makes them inevitable enemies of gay people.",social-group,LGB
2429,"Paprocki is denying people in same sex marriage funeral rites, not gay people.",social-group,LGB
2430,Learn to spell and/or proof your comments before posting.,random,random
2431,"I (don't) know why, please inform me! That is why I posted my comment. It is not due to gay issue because the Boy Scout USA had already agreed that the Churches  can exclude Gay troop master's if they want to.",social-group,LGB
2432,"You're just mad because we are the world superpower and have accomplished more than you, and you have nothing to say for yourself.",random,random
2433,You look into people's eyes,moral,care
2434,All women are strong and are able to become leaders if they want to,moral,authority
2435,"Of course, Naomi Klein's not arguing we should force the third world to pay for emissions reductions, but keep tilting at that windmill Ms. Wente.",moral,fairness
2436,"It's almost certainly ISIS or other Islamist terrorists.  A nightclub = booze + fun; Nightclub on the European side of Istanbul; Nightclub frequented by foreigners.  ISIS and other Islamists hate Europeans, booze and people having a good time.",social-group,muslim
2437,Trudeau needs to talk about the millions murdered by Muslims. The fact their religion does not respect human rights.,social-group,muslim
2438,Jewish fundamentalists (Haredim) in Israel would prefer a rabbinate rather than democracy- a Jewish version of Sharia law.,social-group,jewish
2439,"Another, Want to ease the suffering of your working life? Don't suck up to your corrupt corporate employers and don't kick down on ordinary working folks.",random,random
2440,"Some ex-Jews are so fed up with the false equivalence of Judaism with Zionism  that they have decided that they are not Jews. Don't dare speak out publicly, but can quietly avoid ticking the 'Jewish' box on the census.",social-group,jewish
2441,"Dare yourself to travel to those banned countries, anytime? Be aware that not only americans have got killed in those places, but also europeans, and other non-muslim foreigners who happened to be there.",social-group,muslim
